{
  "report": {
    "title": "July 8, 2026 — Onboarding Phase Assessment",
    "source_md": "output/2026-07-08-phase-assessment.md",
    "run_metadata": "Framework v3.5 · run 2026-07-08 · all metrics pulled from live Postgres, BigQuery (Fathom / Help Scout), and HubSpot at run time."
  },
  "agenda": {
    "resolve": [
      {
        "lead": "Dorell Fabrics — set up and invite reps.",
        "detail_html": "The catalog is built, all 389 customers are matched to a price list, and an admin has already run a real customer order through the app. The only thing left before reps can sell is creating rep accounts and inviting them. (Also retire the old “single net price” note — they now run 11 price lists.)"
      },
      {
        "lead": "The Coppersmith — fill the rep group and invite reps.",
        "detail_html": "The catalog is built (720 customers loaded, 99% of products have a photo), but the rep group that was created still has nobody in it."
      }
    ],
    "discuss": [
      {
        "lead": "Lib and Co. has hit every go-live signal — confirm go-live.",
        "detail_html": "Thirty-one reps are actively using the iPad (through today), real customer orders are flowing, and support has shifted to Kyla. One open thread reports a handful of missing item numbers — close that, then flip them to active and hand the Business Central integration build off to ongoing tracking."
      }
    ],
    "on_track": [
      {
        "lead": "Skyard / Pebl",
        "detail_html": "is live and selling (12 active reps, 87 orders). Kylor is wrapping up one last item before the formal handoff to our support team."
      }
    ]
  },
  "clients": [
    {
      "short": "drf",
      "name": "Dorell Fabrics",
      "phase_n": 4,
      "phase_name": "Catalog ready",
      "next_phase_name": "Reps using the iPad",
      "product": "eCat iPad",
      "days": "84",
      "days_qualifier": "",
      "engagement": "Active over support email; last call was the May 18 implementation check-in",
      "one_thing": "Reps haven't been set up yet — the catalog and customers are ready for them.",
      "current_step": 5,
      "integration": { "mode": "none" },
      "steps": [
        { "no": 1, "label": "Kickoff", "status": "done", "what_we_see": "Kicked off in April; path-forward and implementation calls done." },
        { "no": 2, "label": "First import", "status": "done", "what_we_see": "1,627 products loaded." },
        { "no": 3, "label": "Building the catalog", "status": "done", "what_we_see": "96% of products have a photo; 11 price lists now set up (List, Net, Retail, Canadian, FOB, C2C, and more)." },
        { "no": 4, "label": "Catalog ready", "status": "done", "what_we_see": "389 customers loaded and every one is matched to a price list; an admin has run a real customer order (AMALFI) through the app." },
        { "no": 5, "label": "Reps using the iPad", "status": "not_started", "what_we_see": "No rep group created yet — the three non-admin users are still in the default group." },
        { "no": 6, "label": "Admin trained", "status": "not_started", "what_we_see": "Order-confirmation email isn't set yet; no handoff to our support team." },
        { "no": 7, "label": "Live", "status": "not_started", "what_we_see": "Not live." }
      ],
      "next_step": "Create rep groups, add the reps, and send invitations — the catalog and customers are ready for them.",
      "flags": [
        { "step": "3", "issue": "Old “single net price” note is now out of date", "code": "STALE_OVERRIDE", "source": "Database", "said_html": "Eleven price lists are now set up (List, Net, Retail, Canadian List/Lowest, FOB List/Lowest, C2C List/Lowest, MFR, WHS), so the saved “single net price by design” note should be retired." },
        { "step": "4", "issue": "No product options — by design", "code": null, "source": "Database", "said_html": "Zero options and zero option groups — the expected per-SKU fabric model, not a gap." },
        { "step": "5", "issue": "Extra test orders billed to “Suzanne”", "code": "SELF_TEST_SUSPECTED_NOT_CUSTOMER", "source": "Database", "said_html": "Four submitted orders are billed to “Suzanne” (the admin's own name) and match no customer — these look like admin test orders. The one real customer order (AMALFI) is separate and genuine." }
      ],
      "note_html": "The order path is already being exercised — one real customer order has gone through — even though reps aren't set up yet. The remaining gap is purely getting reps into the app.",
      "activity": {
        "meetings": "6 in the last 90 days — last was “SuperCat / Dorell: Implementation Check-In” on May 18.",
        "support": "4 email threads (39 messages, 1 still open) — last reply July 7.",
        "imports": "Products re-uploaded July 6 (clean) and product stories July 8; customers loaded back in late April (warning-only)."
      },
      "bottom_line": "Dorell Fabrics is the furthest along of the three still building — catalog built, all 389 customers matched to a price list, and a real customer order already run through by an admin. The single open item is reps: none are set up yet. Two housekeeping notes: they've moved to a full 11-price-list setup (so the old “single net price” note should be dropped), and their lack of product options is intentional."
    },
    {
      "short": "tcs",
      "name": "The Coppersmith",
      "phase_n": 4,
      "phase_name": "Catalog ready",
      "next_phase_name": "Reps using the iPad",
      "product": "eCat iPad",
      "days": "79",
      "days_qualifier": "",
      "engagement": "Talking regularly — a call today and email through today",
      "one_thing": "The rep group is empty — no reps are using the iPad yet.",
      "current_step": 5,
      "integration": {
        "mode": "certified",
        "note": "The Coppersmith is building their own integration (a “Certified Pipeline”); we certify it rather than run it."
      },
      "steps": [
        { "no": 1, "label": "Kickoff", "status": "done", "what_we_see": "Kicked off April 21; check-ins running, most recently a “Path Forward” call today." },
        { "no": 2, "label": "First import", "status": "done", "what_we_see": "395 products loaded." },
        { "no": 3, "label": "Building the catalog", "status": "done", "what_we_see": "99% of products have a photo; options and stories loaded; two price lists set up." },
        { "no": 4, "label": "Catalog ready", "status": "done", "what_we_see": "720 customers loaded and every one is matched to a price list." },
        { "no": 5, "label": "Reps using the iPad", "status": "in_progress", "what_we_see": "A “Rep Group” was created but nobody's been added to it yet." },
        { "no": 6, "label": "Admin trained", "status": "not_started", "what_we_see": "Order-confirmation email isn't set yet; no handoff to our support team." },
        { "no": 7, "label": "Live", "status": "not_started", "what_we_see": "Not live." }
      ],
      "next_step": "Add reps to the “Rep Group” and send invitations so reps can start using the iPad.",
      "flags": [
        { "step": "5", "issue": "Rep group created but empty", "code": "USER_TYPES_EMPTY", "source": "Database", "said_html": "A “Rep Group” exists with zero members — the scaffolding is built but no reps have been added." },
        { "step": "3", "issue": "Same warnings on every product import", "code": "RECURRING_WARNINGS_NO_ERROR", "source": "Database", "said_html": "<blockquote class=\"oa-quote\">“Line 1: Field name Feature1 is unknown.”</blockquote><span>27 of 51 product imports carry this (Feature1–5) and 37 carry “Missing UPCValue.” Decide: register those custom fields, drop them from the file, or accept the warnings.</span>" }
      ],
      "note_html": "Two smaller notes: only 129 of 395 products are set to show on the iPad (the rest are intentionally hidden), and one customer row was skipped on the last import because its buyer email was invalid — worth a quick confirm that both are expected.",
      "activity": {
        "meetings": "6 in the last 90 days — last was “CopperSmith / SuperCat: Path Forward” today, July 8.",
        "support": "9 email threads (70 messages, 2 still open) — last reply July 8.",
        "imports": "Products, options, option groups, and stories all re-loaded July 6 (products warning-only on unknown fields); customers loaded June 26."
      },
      "bottom_line": "The Coppersmith's catalog is built, image-rich, and now has 720 customers all matched to a price list. The one thing holding them at “catalog ready” is reps — a rep group exists but is empty, so nobody's using the iPad yet. They're building their own integration (we just certify it), so there's nothing for us to build there. The recurring custom-field warnings are worth cleaning up but aren't blocking anything."
    },
    {
      "short": "libco",
      "name": "Lib and Co.",
      "phase_n": 7,
      "phase_name": "Live",
      "next_phase_name": "Live",
      "product": "eCat iPad",
      "days": "107",
      "days_qualifier": "",
      "engagement": "Very active — reps trained and using the app, heavy support email, last check-in July 2",
      "one_thing": "Effectively live — confirm go-live and close one open thread about a few missing item numbers.",
      "current_step": 7,
      "integration": {
        "mode": "managed",
        "status": "in_progress",
        "what_we_see": "Managed Business Central integration is ours to run and is still in the build stage (Brent building)."
      },
      "steps": [
        { "no": 1, "label": "Kickoff", "status": "done", "what_we_see": "Kicked off in May; kickoff, path-to-live, and rep-training calls all done." },
        { "no": 2, "label": "First import", "status": "done", "what_we_see": "872 products loaded." },
        { "no": 3, "label": "Building the catalog", "status": "done", "what_we_see": "92% of products have a photo; inventory and stories loaded; four price lists set up." },